,date,event,location
0,2021-01-06,Storming of the United States Capitol,"Washington, D.C., USA"
1,2021-03-11,One year anniversary of WHO declaring COVID-19 a pandemic,Global
2,2021-05-23,Suez Canal blockage by container ship disrupts global trade,"Suez Canal, Egypt"
3,2021-07-23 to 2021-08-08,Tokyo 2020 Summer Olympics held after postponement,"Tokyo, Japan"
4,2021-08-15,Taliban retake control of Afghanistan,Afghanistan
5,2021-10-31,COP26 global climate summit concludes with new pledges,"Glasgow, Scotland"
6,2021-11-30,Omicron COVID-19 variant first reported to WHO,South Africa
