,date,event,location
0,2019-05-23,BJP wins majority in General Elections,India
1,2019-08-05,Article 370 revoked; special status of Jammu and Kashmir ended,Jammu and Kashmir
2,2019-12-11,Supreme Court rules Ram Janmabhoomi land dispute verdict,India
3,2019-02-27,Pulwama terror attack kills 40 CRPF personnel,"Pulwama, Jammu and Kashmir"
4,2019-03-14,Balakot air strike by India in Pakistan-administered Kashmir,"Balakot, Pakistan"
5,2019-04-11,"Lok Sabha elections begin, world’s largest democratic exercise",India
6,2019-11-08,Supreme Court rules against triple talaq practice,India
