date,heading,main_content,location,url
5/2/2025,Myanmar crisis deepens as military attacks persist and needs grow,"More than a month after two powerful earthquakes devastated Myanmar, the country is spiralling deeper into crisis as continued military attacks, obstructed aid access and widespread displacement leave nearly 6.3 million people in urgent need.
The 28 March quakes killed over 3,800 people and damaged or destroyed more than 55,000 homes across multiple regions, including Bago, Kayin, Magway, Mandalay, Southern Shan, Naypyitaw and Sagaing.

Families already displaced by years of conflict now face early torrential rains, extreme heat and rising risk of disease. Nearly 20 million people ñ more than a third of the population ñ needed assistance even before the earthquakes.

Unremitting violence

Despite the scale of the disaster, High Commissioner for Human Rights Volker T¸rk warned on Friday that the Myanmar military has launched at least 243 attacks ñ including 171 airstrikes ñ since the massive tremors.

Most of the attacks occurred after 2 April, despite both the military and the opposition National Unity Government (NUG) announcing unilateral ceasefires which were largely unobserved.

ìIt is imperative that the military immediately stop all attacks on civilians and civilian objects,î he said in his statement, calling for a genuine and permanent nationwide halt to hostilities and a return to civilian rule.

He underscored the need to put the people of Myanmar first, prioritise their rights, and achieve a peaceful resolution.

ìInstead of further futile investment in military force, the focus must be on the restoration of democracy and the rule of law in Myanmar,î Mr. T¸rk said.

Tweet URL

Delays putting lives at risk

UN humanitarians in the country also warn that the situation remains dire.

Speaking to journalists in New York via video link from Yangon, Humanitarian Coordinator ad interim Marcoluigi Corsi said that one month on, people are still living in the open and facing increasingly difficult conditions.

ìThe suffering is immense and the stakes are very high,î he said on Thursday, urging the international community to translate funding pledges into rapid, large-scale support.

ìEvery delay means more lives at risk and more communities in Myanmar struggling to rebuild.î

Lack of funding imperils response

Agencies have reached 600,000 people with water, sanitation and hygiene services. They have also provided nearly 500,000 people with food assistance and over 100,000 with emergency shelter.

But the response remains constrained by severe underfunding.

Mr. Corsi called on donors to urgently disburse their pledged amounts. Without timely action, the crisis would get worse, he warned.

ìLives depend on our collective commitment to delivering the support that is desperately neededÖthe time to act is now,î he said.

The $275 million addendum to the 2025 humanitarian response plan has received just $34 million ñ or about 12 per cent ñ leaving affected communities without assistance.

Disease outbreak risk

According to the UN World Health Organization (WHO) over 450,000 people require critical health services, but only about 33,600 have been reached so far.  

Disease outbreaks are also a growing concern as nine of the 20 townships most at risk for cholera fall within earthquake-affected areas. Stagnant water from delayed rubble removal is creating mosquito breeding grounds, driving up the risk of malaria and dengue.  

Limited access to medicines and medical supplies are further straining already overstretched health facilities.",global,https://news.un.org/en/story/2025/05/1162881
1/17/2025,UN says Sudan war turning 'more dangerous' for civilians after Al-Jazira attacks,"The United Nations human rights chief warned Friday that the war in Sudan is becoming ""more dangerous"" for civilians, following reports from rights groups of army-allied militias carrying out ethnic-based attacks on minorities in Al-Jazira state.

The ""Sudan conflict (is) taking more dangerous turn for civilians,"" UN Human Rights Commissioner Volker Turk said on social media platform X, adding that ""there is evidence of... war crimes and other atrocity crimes"".

The Sudanese army, at war with rival paramilitaries since April 2023, led an offensive this week on Al-Jazira state, recapturing its capital Wad Madani from the Rapid Support Forces (RSF).

Rights groups said on Monday that at least 13 people including two children were killed in ethnically-targeted attacks against minority communities in the agricultural state.

Though the RSF has become notorious for alleged ethnic-based violence, reports have also emerged of civilians being targeted on the basis of ethnicity in army-controlled areas.

On Thursday, the US treasury department announced sanctions against army chief Abdel Fattah al-Burhan, accusing the army of attacking schools, markets and hospitals, as well as using food deprivation as a weapon of war.

It came a week after the US also slapped sanctions on RSF commander Mohamed Hamdan Daglo, accusing his group of committing genocide.

Responding to recent reports from US officials of the Sudanese army using chemical weapons in Sudan, spokesperson of the UN human rights chief Ravina Shamdasani said Friday that due to limited access, the UN ""has not specifically documented"" such practices during the war.

At a briefing on Friday, Shamdasani described the reports as ""very worrying"", adding that ""they do require further investigation"".

She said what the UN has documented is ""the use of extremely heavy weaponry in populated areas"", including air strikes on marketplaces.Both sides have been accused of targeting civilians and indiscriminately shelling residential areas, with the RSF specifically accused of ethnic cleansing, systematic sexual violence and laying siege to entire towns.

The war has killed tens of thousands, uprooted over 12 million and pushed the country to the brink of famine, creating what the United Nations describes as one of the world's worst humanitarian crises.

In its latest reports, the International Committee of the Red Cross (ICRC) said that over 120,000 people have fled the ongoing violence in the southern Sudanese states of Blue Nile, White Nile and Sennar to South Sudan since early December 2024.",Sudan,https://www.newindianexpress.com/world/2025/Jan/17/un-says-sudan-war-turning-more-dangerous-for-civilians-after-al-jazira-attacks
1/16/2025,Israel-Hamas ceasefire Updates: Netanyahu accuses Hamas of backtracking on Gaza truce and hostage deal; militant group rejects claim,"Two Hamas leaders on Thursday (January 16, 2025) rejected Israeli allegations that the Palestinian militant group was backtracking on elements of the Gaza ceasefire and hostage release deal announced the day beforesraeli media said the governmentís ratification of the agreement may be delayed in part due to disagreements within the ruling coalition. ìThere is no basis to Netanyahuís claims about the movement backtracking from terms in the ceasefire agreement,î Hamas official Sami Abu Zuhri told AFP.

  Qatarís Prime Minister said on Wednesday that Israel and Hamas had agreed to a ceasefire in Gaza starting on Sunday and a hostage and prisoner exchange after 15 months of war.

The deal would bring to a pause, a devastating 15-month war in the Gaza Strip and raising the possibility of winding down the the deadliest and most destructive fighting between the bitter enemies. The agreement, coming after weeks of painstaking negotiations in the Qatari capital, promises the release of dozens of hostages held by Hamas in phases, the release of hundreds of Palestinian prisoners in Israel and would allow hundreds of thousands of people displaced in Gaza to return to what remains of their homes. It also would flood badly needed humanitarian aid into a devastated territory.

But Israeli Prime Minister Benjamin Netanyahu said early on Thursday that Hamas has backtracked on an earlier understanding of the ceasefire agreement. His statement could indicate that obstacles remain to implementing the deal.",Global,https://www.thehindu.com/news/international/israel-hamas-ceasefire-agreement-on-january-15-2025/article69102175.ece
6/7/2025,Explained: International efforts to end Israelís war in Gaza,"The United Nations Security Council (UNSC) on Wednesday (June 4) failed to pass a resolution calling for ìan immediate, unconditional and permanent ceasefire in Gazaî, after a veto by the United States, with all other members voting in favour. The death toll in Gaza has reached almost 55,000 as Israel has continued its renewed ground offensive, launched on May 17, in the Palestinian enclave. Also, the distribution of humanitarian aid, by a US- and Israel-backed NGO, in the Strip has been marred with chaos, confusion, and numerous shooting deaths.",Global,https://indianexpress.com/article/explained/explained-global/international-efforts-end-israel-war-gaza-10053630/
6/26/2025,"Indian markets hit 2025 highs on geopolitical relief, corporate strength","CHENNAI: The Indian stock market extended its winning streak for the third consecutive session on Thursday, buoyed by positive geopolitical developments and robust corporate performance. Both the BSE Sensex and NSE Nifty50 indices closed at their highest levels in 2025, reflecting sustained investor optimism.

The key driver of Thursdayís rally was the announcement of a ceasefire between Iran and Israel, which eased geopolitical tensions in the Middle East, a region closely watched by global markets due to its impact on crude oil prices and energy security. This development boosted risk appetite among investors, resulting in strong buying momentum in Indian equities.

The BSE Sensex surged by 1,000.36 points, or 1.21%, to settle at 83,755.87, marking its highest close since October 2024.

The Nifty50 mirrored this bullish trend, rising 304.25 points, or 1.21%, to close at 25,549.

Sectoral Highlights: The rally was broad-based but notably led by financials and energy sectors.

The Bank Nifty index hit a record high, propelled by strong gains in heavyweight HDFC Bank, which continued to show robust quarterly results and stable asset quality.

Energy major Reliance Industries Limited (RIL) played a crucial role, with its market capitalization surpassing the ?20 lakh crore milestone, supported by its diversified business model spanning refining, telecom, and retail.

Broader Market Trends

Domestic institutional investors (DIIs) remained net buyers amid positive global cues, while foreign portfolio investors (FPIs) showed cautious optimism, balancing geopolitical concerns with strong economic data. The governmentís recent focus on infrastructure spending and easing of regulatory hurdles also underpinned market sentiment.

Commodity & Currency Outlook

Brent crude oil prices stabilised around $82 per barrel following the ceasefire announcement, alleviating inflationary concerns.

The Indian rupee strengthened marginally against the US dollar, closing near 81.10, supported by foreign fund inflows and steady capital markets.

Market analysts believe the current momentum is likely to continue in the near term, driven by easing geopolitical risks and encouraging domestic economic indicators such as improving PMI data and sustained corporate earnings growth. However, they caution investors to watch for global inflation trends and central bank policy cues, which could impact volatility.",India,https://www.newindianexpress.com/business/2025/Jun/26/indian-markets-hit-2025-highs-on-geopolitical-relief-corporate-strength
6/12/2025,Indian markets remain volatile amid global uncertainties and geopolitical tensions,"CHENNAI: Indian equity markets remained volatile on Thursday amid heightened volatility, as global uncertainty and geopolitical tensions continued to weigh on investor sentiment. Weak global cues, combined with rising crude oil prices and mixed corporate activity, contributed to broad-based selling across sectors. BSE Sensex at 82,254.04 fell 261.10 points or 0.32% at 12.49 am and Nifty 50 shed 106 points or 0.42% to 25,035.20.

Broader markets like Nifty MidCap 100 and Nifty Small Cap too mirrored the benchmark indices sliding 0.86% each.

Global Cues

Today's investor caution mainly stemmed from the ongoing assessment of the US-China trade agreement progress, and tensions in the Middle East, especially between US and Iran, lifting global crude oil prices and increasing fears of inflationary pressure

Mixed signals from the US Federal Reserve on the interest rate trajectory also caused market worries.

Today's only sectoral gainer was Nifty Pharma (0.7%) in the morning trade. While the sectoral losers were Nifty FMCG and Nifty Realty, which are 1.0% down due to rate sensitivity and concerns around demand growth weighed on these sectors.

At the same time, a defensive buying trend helped lift pharmaceutical stocks amid global uncertainty.

Top stocks performed today under Sensex were Asian Paints, Bajaj Finserv, Sun Pharma. While, the top losers included Infosys, Eternal, Tata Motors, Mahindra & Mahindra (M&M), and Hindustan Unilever (HUL).

Stocks in Focus

Share prices of Paytm's parent One 97 Communications Ltd declined 10% to ?864.20 today, triggered by a sharp sell-off on high volumes following the Finance Ministryís denial of reports suggesting a merchant discount rate (MDR) being charged on UPI transactions.

Sentiment was hit due to perceived regulatory overhang and profitability concerns in digital payments.

Similarly, Asian Paints witnessed high activity with 35 million shares changing hands in a large block deal during the pre-opening session on NSE.

The stock ended among the top gainers, possibly buoyed by strategic buying amid stable fundamentals.

According to analysts near-term market direction is now likely to be guided by global risk sentiment and oil price trends, any further updates on the US-China trade dynamic, domestic macroeconomic indicators such as inflation data and IIP figures, and movement in foreign institutional investment (FII) flows.

(Disclaimer: The stock trends mentioned in this report are for informational purposes only. Investors are advised to seek professional advice and rely on authentic market intelligence before making any investment decisions.)

",India,https://www.newindianexpress.com/business/2025/Jun/12/indian-markets-remain-volatile-amid-global-uncertainties-and-geopolitical-tensions
